{
  "scene_pack_version": "0.1.0",
  "scene_id": "BRH-001-GAP-FIXTURE",
  "requested_interval": {
    "from": null,
    "to": null
  },
  "resolved_state_id": "NN:state:brihadisvara:gap-001",
  "state_kind": "GAP",
  "entities": [
    "NN:site:brihadisvara-thanjavur"
  ],
  "layers": [],
  "events": [],
  "evidence_refs": [],
  "asset_refs": [],
  "uncertainty": {
    "code": "NO_SUPPORTED_RECONSTRUCTION",
    "message": "No reviewed historical reconstruction is currently available for the requested interval in the current project dataset."
  },
  "attribution": [],
  "rights_notices": [
    "Entity source/rights status is REVIEW_REQUIRED; this pack embeds no source media or third-party visual assets."
  ],
  "data_gaps": [
    "NN:state:brihadisvara:gap-001"
  ],
  "renderer_hints": {
    "flat": true,
    "peppers_ghost": true,
    "relief_projection": true,
    "historical_geometry": false,
    "asset_fallback_allowed": false
  },
  "generated_at": null,
  "generator_version": "0.1.0"
}
